{
 "exec_id": "EXEC-a9b19962f6",
 "campaign_id": "C-45488bdaf5",
 "profile": "docker-networkless",
 "finding_id": "F-df01bb454ed5",
 "artifact_id": null,
 "command": "forge test --match-test test_p2_cross",
 "workdir": null,
 "policy_verdict": {
  "allowed": true,
  "violations": [],
  "checked_rules": [
   "network-egress-tool",
   "privilege-escalation",
   "destructive-path",
   "secret-access",
   "external-publish",
   "system-write"
  ]
 },
 "environment": {
  "tool_versions": {},
  "env_keys": [],
  "network_access": "none",
  "filesystem": "sandbox-tmp"
 },
 "container": null,
 "origin": "externally-reported",
 "reported_by": "verify-full-harness",
 "input_hashes": {},
 "started_at": "2026-09-09T12:00:59.000000+00:00",
 "finished_at": "2026-09-09T12:00:59.000000+00:00",
 "exit_status": 0,
 "stdout_path": "/home/xand/Projects/dsh-plugins/websec2/web3sec-go/.scratch/verify-p1/pyroot/campaigns/C-45488bdaf5/execs/EXEC-a9b19962f6/stdout.log",
 "stderr_path": "/home/xand/Projects/dsh-plugins/websec2/web3sec-go/.scratch/verify-p1/pyroot/campaigns/C-45488bdaf5/execs/EXEC-a9b19962f6/stderr.log",
 "artifact_hashes": {
  "stdout.log": "37dbf8f9438bced75e05cf49ca6b188572d104a015ed1d0b64b6bece3ee475f7",
  "stderr.log": "e3b0c44298fc1c149afbf4c8996fb92427ae41e4649b934ca495991b7852b855"
 }
}
